availability,price,product_page_url,rating,title
In stock,£58.33,https://books.toscrape.com/catalogue/silence-in-the-dark-logan-point-4_542/index.html,star-rating Three,Silence in the Dark (Logan Point #4)
In stock,£39.67,https://books.toscrape.com/catalogue/shadows-of-the-past-logan-point-1_541/index.html,star-rating Five,Shadows of the Past (Logan Point #1)
In stock,£14.10,https://books.toscrape.com/catalogue/roller-girl_540/index.html,star-rating Five,Roller Girl
In stock,£21.82,https://books.toscrape.com/catalogue/rising-strong_539/index.html,star-rating Three,Rising Strong
In stock,£54.21,https://books.toscrape.com/catalogue/proofs-of-god-classical-arguments-from-tertullian-to-barth_538/index.html,star-rating One,Proofs of God: Classical Arguments from Tertullian to Barth
In stock,£31.19,https://books.toscrape.com/catalogue/please-kill-me-the-uncensored-oral-history-of-punk_537/index.html,star-rating Four,Please Kill Me: The Uncensored Oral History of Punk
In stock,£53.64,https://books.toscrape.com/catalogue/out-of-print-city-lights-spotlight-no-14_536/index.html,star-rating Five,Out of Print: City Lights Spotlight No. 14
In stock,£36.39,https://books.toscrape.com/catalogue/my-life-next-door-my-life-next-door_535/index.html,star-rating Five,My Life Next Door (My Life Next Door )
In stock,£58.54,https://books.toscrape.com/catalogue/millers-valley_534/index.html,star-rating Two,Miller's Valley
In stock,£29.48,https://books.toscrape.com/catalogue/mans-search-for-meaning_533/index.html,star-rating Three,Man's Search for Meaning
In stock,£25.06,https://books.toscrape.com/catalogue/love-that-boy-what-two-presidents-eight-road-trips-and-my-son-taught-me-about-a-parents-expectations_532/index.html,star-rating Two,"Love That Boy: What Two Presidents, Eight Road Trips, and My Son Taught Me About a Parent's Expectations"
In stock,£12.55,https://books.toscrape.com/catalogue/living-forward-a-proven-plan-to-stop-drifting-and-get-the-life-you-want_531/index.html,star-rating Three,Living Forward: A Proven Plan to Stop Drifting and Get the Life You Want
In stock,£29.04,https://books.toscrape.com/catalogue/les-fleurs-du-mal_530/index.html,star-rating Five,Les Fleurs du Mal
In stock,£40.72,https://books.toscrape.com/catalogue/left-behind-left-behind-1_529/index.html,star-rating Two,Left Behind (Left Behind #1)
In stock,£45.05,https://books.toscrape.com/catalogue/kill-em-and-leave-searching-for-james-brown-and-the-american-soul_528/index.html,star-rating Five,Kill 'Em and Leave: Searching for James Brown and the American Soul
In stock,£47.13,https://books.toscrape.com/catalogue/kierkegaard-a-christian-missionary-to-christians_527/index.html,star-rating One,Kierkegaard: A Christian Missionary to Christians
In stock,£20.22,https://books.toscrape.com/catalogue/john-vassos-industrial-design-for-modern-life_526/index.html,star-rating Four,John Vassos: Industrial Design for Modern Life
In stock,£56.48,https://books.toscrape.com/catalogue/ill-give-you-the-sun_525/index.html,star-rating One,I'll Give You the Sun
In stock,£44.21,https://books.toscrape.com/catalogue/i-will-find-you_524/index.html,star-rating One,I Will Find You
In stock,£21.96,https://books.toscrape.com/catalogue/hystopia-a-novel_523/index.html,star-rating Four,Hystopia: A Novel
In stock,£40.45,https://books.toscrape.com/catalogue/howl-and-other-poems_522/index.html,star-rating Two,Howl and Other Poems
In stock,£10.29,https://books.toscrape.com/catalogue/history-of-beauty_521/index.html,star-rating Four,History of Beauty
In stock,£52.86,https://books.toscrape.com/catalogue/heaven-is-for-real-a-little-boys-astounding-story-of-his-trip-to-heaven-and-back_520/index.html,star-rating Two,Heaven is for Real: A Little Boy's Astounding Story of His Trip to Heaven and Back
In stock,£55.65,https://books.toscrape.com/catalogue/future-shock-future-shock-1_519/index.html,star-rating Five,Future Shock (Future Shock #1)
In stock,£43.64,https://books.toscrape.com/catalogue/enders-game-the-ender-quintet-1_518/index.html,star-rating One,Ender's Game (The Ender Quintet #1)
In stock,£28.41,https://books.toscrape.com/catalogue/diary-of-a-citizen-scientist-chasing-tiger-beetles-and-other-new-ways-of-engaging-the-world_517/index.html,star-rating One,Diary of a Citizen Scientist: Chasing Tiger Beetles and Other New Ways of Engaging the World
In stock,£37.51,https://books.toscrape.com/catalogue/death-by-leisure-a-cautionary-tale_516/index.html,star-rating Four,Death by Leisure: A Cautionary Tale
In stock,£11.45,https://books.toscrape.com/catalogue/brilliant-beacons-a-history-of-the-american-lighthouse_515/index.html,star-rating Three,Brilliant Beacons: A History of the American Lighthouse
In stock,£19.22,https://books.toscrape.com/catalogue/brazen-the-courage-to-find-the-you-thats-been-hiding_514/index.html,star-rating Two,Brazen: The Courage to Find the You That's Been Hiding
In stock,£56.91,https://books.toscrape.com/catalogue/between-the-world-and-me_513/index.html,star-rating Four,Between the World and Me
In stock,£55.06,https://books.toscrape.com/catalogue/being-mortal-medicine-and-what-matters-in-the-end_512/index.html,star-rating Four,Being Mortal: Medicine and What Matters in the End
In stock,£13.20,https://books.toscrape.com/catalogue/a-murder-over-a-girl-justice-gender-junior-high_511/index.html,star-rating Three,"A Murder Over a Girl: Justice, Gender, Junior High"
In stock,£53.63,https://books.toscrape.com/catalogue/32-yolks_510/index.html,star-rating Two,32 Yolks
In stock,£44.48,https://books.toscrape.com/catalogue/most-blessed-of-the-patriarchs-thomas-jefferson-and-the-empire-of-the-imagination_509/index.html,star-rating Five,"""Most Blessed of the Patriarchs"": Thomas Jefferson and the Empire of the Imagination"
In stock,£12.08,https://books.toscrape.com/catalogue/you-are-a-badass-how-to-stop-doubting-your-greatness-and-start-living-an-awesome-life_508/index.html,star-rating Three,You Are a Badass: How to Stop Doubting Your Greatness and Start Living an Awesome Life
In stock,£22.14,https://books.toscrape.com/catalogue/wildlife-of-new-york-a-five-borough-coloring-book_507/index.html,star-rating Two,Wildlife of New York: A Five-Borough Coloring Book
In stock,£25.37,https://books.toscrape.com/catalogue/what-happened-on-beale-street-secrets-of-the-south-mysteries-2_506/index.html,star-rating Five,What Happened on Beale Street (Secrets of the South Mysteries #2)
In stock,£46.33,https://books.toscrape.com/catalogue/unreasonable-hope-finding-faith-in-the-god-who-brings-purpose-to-your-pain_505/index.html,star-rating Two,Unreasonable Hope: Finding Faith in the God Who Brings Purpose to Your Pain
In stock,£37.33,https://books.toscrape.com/catalogue/under-the-tuscan-sun_504/index.html,star-rating Three,Under the Tuscan Sun
In stock,£25.55,https://books.toscrape.com/catalogue/toddlers-are-aholes-its-not-your-fault_503/index.html,star-rating One,Toddlers Are A**holes: It's Not Your Fault
In stock,£34.72,https://books.toscrape.com/catalogue/the-year-of-living-biblically-one-mans-humble-quest-to-follow-the-bible-as-literally-as-possible_502/index.html,star-rating One,The Year of Living Biblically: One Man's Humble Quest to Follow the Bible as Literally as Possible
In stock,£35.96,https://books.toscrape.com/catalogue/the-whale_501/index.html,star-rating Four,The Whale
In stock,£41.14,https://books.toscrape.com/catalogue/the-story-of-art_500/index.html,star-rating Four,The Story of Art
In stock,£10.01,https://books.toscrape.com/catalogue/the-origin-of-species_499/index.html,star-rating Four,The Origin of Species
In stock,£36.05,https://books.toscrape.com/catalogue/the-great-gatsby_498/index.html,star-rating Four,The Great Gatsby
In stock,£49.03,https://books.toscrape.com/catalogue/the-good-girl_497/index.html,star-rating Three,The Good Girl
In stock,£16.24,https://books.toscrape.com/catalogue/the-glass-castle_496/index.html,star-rating One,The Glass Castle
In stock,£39.55,https://books.toscrape.com/catalogue/the-faith-of-christopher-hitchens-the-restless-soul-of-the-worlds-most-notorious-atheist_495/index.html,star-rating One,The Faith of Christopher Hitchens: The Restless Soul of the World's Most Notorious Atheist
In stock,£35.67,https://books.toscrape.com/catalogue/the-drowning-girls_494/index.html,star-rating Three,The Drowning Girls
In stock,£16.62,https://books.toscrape.com/catalogue/the-constant-princess-the-tudor-court-1_493/index.html,star-rating Three,The Constant Princess (The Tudor Court #1)
In stock,£42.78,https://books.toscrape.com/catalogue/the-bourne-identity-jason-bourne-1_492/index.html,star-rating Four,The Bourne Identity (Jason Bourne #1)
In stock,£52.30,https://books.toscrape.com/catalogue/the-bachelor-girls-guide-to-murder-herringford-and-watts-mysteries-1_491/index.html,star-rating Five,The Bachelor Girl's Guide to Murder (Herringford and Watts Mysteries #1)
In stock,£32.34,https://books.toscrape.com/catalogue/the-art-book_490/index.html,star-rating Two,The Art Book
In stock,£33.17,https://books.toscrape.com/catalogue/the-7-habits-of-highly-effective-people-powerful-lessons-in-personal-change_489/index.html,star-rating Four,The 7 Habits of Highly Effective People: Powerful Lessons in Personal Change
In stock,£20.12,https://books.toscrape.com/catalogue/team-of-rivals-the-political-genius-of-abraham-lincoln_488/index.html,star-rating Five,Team of Rivals: The Political Genius of Abraham Lincoln
In stock,£20.90,https://books.toscrape.com/catalogue/steal-like-an-artist-10-things-nobody-told-you-about-being-creative_487/index.html,star-rating Two,Steal Like an Artist: 10 Things Nobody Told You About Being Creative
In stock,£20.90,https://books.toscrape.com/catalogue/sit-stay-love_486/index.html,star-rating Three,"Sit, Stay, Love"
In stock,£40.20,https://books.toscrape.com/catalogue/sister-dear_485/index.html,star-rating Four,Sister Dear
In stock,£52.87,https://books.toscrape.com/catalogue/shrunken-treasures-literary-classics-short-sweet-and-silly_484/index.html,star-rating Three,"Shrunken Treasures: Literary Classics, Short, Sweet, and Silly"
In stock,£51.74,https://books.toscrape.com/catalogue/rich-dad-poor-dad_483/index.html,star-rating One,"Rich Dad, Poor Dad"
In stock,£34.41,https://books.toscrape.com/catalogue/raymie-nightingale_482/index.html,star-rating Two,Raymie Nightingale
In stock,£32.38,https://books.toscrape.com/catalogue/playing-from-the-heart_481/index.html,star-rating One,Playing from the Heart
In stock,£50.35,https://books.toscrape.com/catalogue/nightstruck-a-novel_480/index.html,star-rating Four,Nightstruck: A Novel
In stock,£11.38,https://books.toscrape.com/catalogue/naturally-lean-125-nourishing-gluten-free-plant-based-recipes-all-under-300-calories_479/index.html,star-rating Five,"Naturally Lean: 125 Nourishing Gluten-Free, Plant-Based Recipes--All Under 300 Calories"
In stock,£43.58,https://books.toscrape.com/catalogue/meternity_478/index.html,star-rating Three,Meternity
In stock,£49.67,https://books.toscrape.com/catalogue/memoirs-of-a-geisha_477/index.html,star-rating Three,Memoirs of a Geisha
In stock,£28.77,https://books.toscrape.com/catalogue/like-never-before-walker-family-2_476/index.html,star-rating Two,Like Never Before (Walker Family #2)
In stock,£13.22,https://books.toscrape.com/catalogue/life-of-pi_475/index.html,star-rating Four,Life of Pi
In stock,£51.17,https://books.toscrape.com/catalogue/leave-this-song-behind-teen-poetry-at-its-best_474/index.html,star-rating Five,Leave This Song Behind: Teen Poetry at Its Best
In stock,£39.61,https://books.toscrape.com/catalogue/kings-folly-the-kinsman-chronicles-1_473/index.html,star-rating Five,King's Folly (The Kinsman Chronicles #1)
In stock,£57.43,https://books.toscrape.com/catalogue/john-adams_472/index.html,star-rating Four,John Adams
In stock,£46.01,https://books.toscrape.com/catalogue/how-to-cook-everything-vegetarian-simple-meatless-recipes-for-great-food-how-to-cook-everything_471/index.html,star-rating Four,How to Cook Everything Vegetarian: Simple Meatless Recipes for Great Food (How to Cook Everything)
In stock,£28.25,https://books.toscrape.com/catalogue/how-to-be-a-domestic-goddess-baking-and-the-art-of-comfort-cooking_470/index.html,star-rating Two,How to Be a Domestic Goddess: Baking and the Art of Comfort Cooking
In stock,£37.05,https://books.toscrape.com/catalogue/good-in-bed-cannie-shapiro-1_469/index.html,star-rating Five,Good in Bed (Cannie Shapiro #1)
In stock,£19.57,https://books.toscrape.com/catalogue/fruits-basket-vol-7-fruits-basket-7_468/index.html,star-rating One,"Fruits Basket, Vol. 7 (Fruits Basket #7)"
In stock,£45.13,https://books.toscrape.com/catalogue/for-the-love-fighting-for-grace-in-a-world-of-impossible-standards_467/index.html,star-rating Three,For the Love: Fighting for Grace in a World of Impossible Standards
In stock,£46.64,https://books.toscrape.com/catalogue/finding-god-in-the-ruins-how-god-redeems-pain_466/index.html,star-rating Two,Finding God in the Ruins: How God Redeems Pain
In stock,£12.16,https://books.toscrape.com/catalogue/every-heart-a-doorway-every-heart-a-doorway-1_465/index.html,star-rating Five,Every Heart a Doorway (Every Heart A Doorway #1)
In stock,£20.89,https://books.toscrape.com/catalogue/delivering-the-truth-quaker-midwife-mystery-1_464/index.html,star-rating Four,Delivering the Truth (Quaker Midwife Mystery #1)
In stock,£17.97,https://books.toscrape.com/catalogue/counted-with-the-stars-out-from-egypt-1_463/index.html,star-rating Five,Counted With the Stars (Out from Egypt #1)
In stock,£52.60,https://books.toscrape.com/catalogue/chronicles-vol-1_462/index.html,star-rating Two,"Chronicles, Vol. 1"
In stock,£25.77,https://books.toscrape.com/catalogue/blue-like-jazz-nonreligious-thoughts-on-christian-spirituality_461/index.html,star-rating One,Blue Like Jazz: Nonreligious Thoughts on Christian Spirituality
In stock,£48.19,https://books.toscrape.com/catalogue/benjamin-franklin-an-american-life_460/index.html,star-rating Three,Benjamin Franklin: An American Life
In stock,£29.93,https://books.toscrape.com/catalogue/at-the-existentialist-cafe-freedom-being-and-apricot-cocktails-with-jean-paul-sartre-simone-de-beauvoir-albert-camus-martin-heidegger-edmund-husserl-karl-jaspers-maurice-merleau-ponty-and-others_459/index.html,star-rating Five,"At The Existentialist Café: Freedom, Being, and apricot cocktails with: Jean-Paul Sartre, Simone de Beauvoir, Albert Camus, Martin Heidegger, Edmund Husserl, Karl Jaspers, Maurice Merleau-Ponty and others"
In stock,£44.34,https://books.toscrape.com/catalogue/a-summer-in-europe_458/index.html,star-rating Two,A Summer In Europe
In stock,£52.40,https://books.toscrape.com/catalogue/a-short-history-of-nearly-everything_457/index.html,star-rating Five,A Short History of Nearly Everything
In stock,£44.81,https://books.toscrape.com/catalogue/a-gathering-of-shadows-shades-of-magic-2_456/index.html,star-rating Four,A Gathering of Shadows (Shades of Magic #2)
In stock,£57.84,https://books.toscrape.com/catalogue/the-sound-of-love_455/index.html,star-rating Five,The Sound Of Love
In stock,£39.67,https://books.toscrape.com/catalogue/the-rise-and-fall-of-the-third-reich-a-history-of-nazi-germany_454/index.html,star-rating Two,The Rise and Fall of the Third Reich: A History of Nazi Germany
In stock,£55.02,https://books.toscrape.com/catalogue/the-perks-of-being-a-wallflower_453/index.html,star-rating Three,The Perks of Being a Wallflower
In stock,£24.80,https://books.toscrape.com/catalogue/the-mysterious-affair-at-styles-hercule-poirot-1_452/index.html,star-rating Four,The Mysterious Affair at Styles (Hercule Poirot #1)
In stock,£59.45,https://books.toscrape.com/catalogue/the-man-who-mistook-his-wife-for-a-hat-and-other-clinical-tales_451/index.html,star-rating Four,The Man Who Mistook His Wife for a Hat and Other Clinical Tales
In stock,£31.58,https://books.toscrape.com/catalogue/the-makings-of-a-fatherless-child_450/index.html,star-rating Two,The Makings of a Fatherless Child
In stock,£43.27,https://books.toscrape.com/catalogue/the-joy-of-cooking_449/index.html,star-rating Four,The Joy of Cooking
In stock,£37.34,https://books.toscrape.com/catalogue/the-invention-of-wings_448/index.html,star-rating One,The Invention of Wings
In stock,£17.80,https://books.toscrape.com/catalogue/the-hobbit-middle-earth-universe_447/index.html,star-rating Five,The Hobbit (Middle-Earth Universe)
In stock,£30.54,https://books.toscrape.com/catalogue/the-great-railway-bazaar_446/index.html,star-rating One,The Great Railway Bazaar
In stock,£18.77,https://books.toscrape.com/catalogue/the-golden-compass-his-dark-materials-1_445/index.html,star-rating One,The Golden Compass (His Dark Materials #1)
In stock,£46.85,https://books.toscrape.com/catalogue/the-god-delusion_444/index.html,star-rating Three,The God Delusion
In stock,£15.79,https://books.toscrape.com/catalogue/the-girl-you-left-behind-the-girl-you-left-behind-1_443/index.html,star-rating One,The Girl You Left Behind (The Girl You Left Behind #1)
In stock,£10.27,https://books.toscrape.com/catalogue/the-fellowship-of-the-ring-the-lord-of-the-rings-1_442/index.html,star-rating Two,The Fellowship of the Ring (The Lord of the Rings #1)
In stock,£15.42,https://books.toscrape.com/catalogue/the-collected-poems-of-wb-yeats-the-collected-works-of-wb-yeats-1_441/index.html,star-rating Five,The Collected Poems of W.B. Yeats (The Collected Works of W.B. Yeats #1)
In stock,£59.92,https://books.toscrape.com/catalogue/the-barefoot-contessa-cookbook_440/index.html,star-rating Five,The Barefoot Contessa Cookbook
In stock,£50.96,https://books.toscrape.com/catalogue/tell-the-wolves-im-home_439/index.html,star-rating Two,Tell the Wolves I'm Home
In stock,£30.60,https://books.toscrape.com/catalogue/ship-leaves-harbor-essays-on-travel-by-a-recovering-journeyman_438/index.html,star-rating Three,Ship Leaves Harbor: Essays on Travel by a Recovering Journeyman
In stock,£19.27,https://books.toscrape.com/catalogue/pride-and-prejudice_437/index.html,star-rating Four,Pride and Prejudice
In stock,£46.58,https://books.toscrape.com/catalogue/musicophilia-tales-of-music-and-the-brain_436/index.html,star-rating One,Musicophilia: Tales of Music and the Brain
In stock,£48.51,https://books.toscrape.com/catalogue/mere-christianity_435/index.html,star-rating Three,Mere Christianity
In stock,£19.02,https://books.toscrape.com/catalogue/me-before-you-me-before-you-1_434/index.html,star-rating One,Me Before You (Me Before You #1)
In stock,£38.38,https://books.toscrape.com/catalogue/in-the-woods-dublin-murder-squad-1_433/index.html,star-rating Two,In the Woods (Dublin Murder Squad #1)
In stock,£49.98,https://books.toscrape.com/catalogue/in-cold-blood_432/index.html,star-rating Four,In Cold Blood
In stock,£46.49,https://books.toscrape.com/catalogue/how-to-stop-worrying-and-start-living_431/index.html,star-rating Five,How to Stop Worrying and Start Living
In stock,£18.32,https://books.toscrape.com/catalogue/give-it-back_430/index.html,star-rating Two,Give It Back
In stock,£42.14,https://books.toscrape.com/catalogue/girl-interrupted_429/index.html,star-rating Three,"Girl, Interrupted"
In stock,£56.59,https://books.toscrape.com/catalogue/fun-home-a-family-tragicomic_428/index.html,star-rating Four,Fun Home: A Family Tragicomic
In stock,£20.96,https://books.toscrape.com/catalogue/fruits-basket-vol-6-fruits-basket-6_427/index.html,star-rating Four,"Fruits Basket, Vol. 6 (Fruits Basket #6)"
In stock,£40.32,https://books.toscrape.com/catalogue/deception-point_426/index.html,star-rating Four,Deception Point
In stock,£36.39,https://books.toscrape.com/catalogue/death-note-vol-6-give-and-take-death-note-6_425/index.html,star-rating Three,"Death Note, Vol. 6: Give-and-Take (Death Note #6)"
In stock,£58.55,https://books.toscrape.com/catalogue/catherine-the-great-portrait-of-a-woman_424/index.html,star-rating Four,Catherine the Great: Portrait of a Woman
In stock,£39.61,https://books.toscrape.com/catalogue/better-homes-and-gardens-new-cook-book_423/index.html,star-rating Three,Better Homes and Gardens New Cook Book
In stock,£21.30,https://books.toscrape.com/catalogue/an-unquiet-mind-a-memoir-of-moods-and-madness_422/index.html,star-rating Three,An Unquiet Mind: A Memoir of Moods and Madness
In stock,£56.88,https://books.toscrape.com/catalogue/a-year-in-provence-provence-1_421/index.html,star-rating Four,A Year in Provence (Provence #1)
In stock,£32.97,https://books.toscrape.com/catalogue/world-without-end-the-pillars-of-the-earth-2_420/index.html,star-rating Four,World Without End (The Pillars of the Earth #2)
In stock,£47.31,https://books.toscrape.com/catalogue/will-grayson-will-grayson-will-grayson-will-grayson_419/index.html,star-rating Four,"Will Grayson, Will Grayson (Will Grayson, Will Grayson)"
In stock,£48.67,https://books.toscrape.com/catalogue/why-save-the-bankers-and-other-essays-on-our-economic-and-political-crisis_418/index.html,star-rating Two,Why Save the Bankers?: And Other Essays on Our Economic and Political Crisis
In stock,£41.73,https://books.toscrape.com/catalogue/where-she-went-if-i-stay-2_417/index.html,star-rating Four,Where She Went (If I Stay #2)
In stock,£53.68,https://books.toscrape.com/catalogue/what-if-serious-scientific-answers-to-absurd-hypothetical-questions_416/index.html,star-rating Four,What If?: Serious Scientific Answers to Absurd Hypothetical Questions
In stock,£14.64,https://books.toscrape.com/catalogue/two-summers_415/index.html,star-rating One,Two Summers
In stock,£38.40,https://books.toscrape.com/catalogue/this-is-your-brain-on-music-the-science-of-a-human-obsession_414/index.html,star-rating One,This Is Your Brain on Music: The Science of a Human Obsession
In stock,£15.08,https://books.toscrape.com/catalogue/the-secret-garden_413/index.html,star-rating Four,The Secret Garden
In stock,£30.57,https://books.toscrape.com/catalogue/the-raven-king-the-raven-cycle-4_412/index.html,star-rating Two,The Raven King (The Raven Cycle #4)
In stock,£57.74,https://books.toscrape.com/catalogue/the-raven-boys-the-raven-cycle-1_411/index.html,star-rating Four,The Raven Boys (The Raven Cycle #1)
In stock,£11.05,https://books.toscrape.com/catalogue/the-power-greens-cookbook-140-delicious-superfood-recipes_410/index.html,star-rating Five,The Power Greens Cookbook: 140 Delicious Superfood Recipes
In stock,£28.58,https://books.toscrape.com/catalogue/the-metamorphosis_409/index.html,star-rating One,The Metamorphosis
In stock,£42.91,https://books.toscrape.com/catalogue/the-mathews-men-seven-brothers-and-the-war-against-hitlers-u-boats_408/index.html,star-rating Five,The Mathews Men: Seven Brothers and the War Against Hitler's U-boats
In stock,£24.73,https://books.toscrape.com/catalogue/the-little-paris-bookshop_407/index.html,star-rating Three,The Little Paris Bookshop
In stock,£55.91,https://books.toscrape.com/catalogue/the-hiding-place_406/index.html,star-rating Four,The Hiding Place
In stock,£13.76,https://books.toscrape.com/catalogue/the-grand-design_405/index.html,star-rating Three,The Grand Design
In stock,£45.56,https://books.toscrape.com/catalogue/the-firm_404/index.html,star-rating Three,The Firm
In stock,£47.22,https://books.toscrape.com/catalogue/the-fault-in-our-stars_403/index.html,star-rating One,The Fault in Our Stars
In stock,£56.00,https://books.toscrape.com/catalogue/the-false-prince-the-ascendance-trilogy-1_402/index.html,star-rating Five,The False Prince (The Ascendance Trilogy #1)
In stock,£44.58,https://books.toscrape.com/catalogue/the-expatriates_401/index.html,star-rating Two,The Expatriates
In stock,£34.50,https://books.toscrape.com/catalogue/the-dream-thieves-the-raven-cycle-2_400/index.html,star-rating One,The Dream Thieves (The Raven Cycle #2)
In stock,£11.33,https://books.toscrape.com/catalogue/the-darkest-corners_399/index.html,star-rating Five,The Darkest Corners
In stock,£38.77,https://books.toscrape.com/catalogue/the-crossover_398/index.html,star-rating Four,The Crossover
In stock,£11.83,https://books.toscrape.com/catalogue/the-5th-wave-the-5th-wave-1_397/index.html,star-rating Two,The 5th Wave (The 5th Wave #1)
In stock,£45.51,https://books.toscrape.com/catalogue/tell-the-wind-and-fire_396/index.html,star-rating Three,Tell the Wind and Fire
In stock,£41.81,https://books.toscrape.com/catalogue/tell-me-three-things_395/index.html,star-rating One,Tell Me Three Things
In stock,£25.15,https://books.toscrape.com/catalogue/talking-to-girls-about-duran-duran-one-young-mans-quest-for-true-love-and-a-cooler-haircut_394/index.html,star-rating Four,Talking to Girls About Duran Duran: One Young Man's Quest for True Love and a Cooler Haircut
In stock,£34.22,https://books.toscrape.com/catalogue/siddhartha_393/index.html,star-rating Five,Siddhartha
In stock,£16.23,https://books.toscrape.com/catalogue/shiver-the-wolves-of-mercy-falls-1_392/index.html,star-rating Five,Shiver (The Wolves of Mercy Falls #1)
In stock,£11.48,https://books.toscrape.com/catalogue/remember-me_391/index.html,star-rating Three,Remember Me?
In stock,£23.37,https://books.toscrape.com/catalogue/red-dragon-hannibal-lecter-1_390/index.html,star-rating Three,Red Dragon (Hannibal Lecter #1)
In stock,£16.28,https://books.toscrape.com/catalogue/peak-secrets-from-the-new-science-of-expertise_389/index.html,star-rating Two,Peak: Secrets from the New Science of Expertise
In stock,£31.63,https://books.toscrape.com/catalogue/my-mother-was-nuts_388/index.html,star-rating Four,My Mother Was Nuts
In stock,£24.91,https://books.toscrape.com/catalogue/mexican-today-new-and-rediscovered-recipes-for-contemporary-kitchens_387/index.html,star-rating Five,Mexican Today: New and Rediscovered Recipes for Contemporary Kitchens
